"productAsin","ratingScore","reviewTitle","reviewDescription","date","country","variant","isVerified","position","reviewUrl"
"B003YL4LYI","2","So Many Words, So Little Plot","How, HOW is this book averaging 4 1/2 stars?? When did abject overwriting and lack of plot advancement warrant such a rating? Here were my thoughts going into this book (Spoilers): 1. Surely Daenerys would finally at least BEGIN her journey to Westeros to claim the Iron Throne with her super Unsullied army. - Nope (But ANOTHER Targaryen, whom the reader has spent a whole 30 seconds with, is poised to fight for the throne). 2. Surely we'd see a good, dramatic trial for Cersei. - Not a chance. 3. Surely Tyrion would do something, ANYTHING to get the story moving. - Negative. 4. Surely the White Walkers would finally factor into the story. - No. 5. Surely Stannis would wreak havoc in the North and at least somewhat avenge the annihilation of the Starks and be a real threat for claiming the throne. - Sorry. 6. Surely Dorne would begin to play a larger role in the Game of Thrones. - Don't be silly. 7. Surely Bran will begin to play a part in all of this. - Not quite. He's a tree now. Or a crow. I'm not really certain. How can Martin write SO many pages yet have so little happen? I mean, if you want to know what a character is eating to break their fast, or what color someone's surcoat or tokar is, or what color the bricks of a city are that day, or that words are wind, then this book will be riveting to you. And are we supposed to care more about Westeros or Essos? Becasue ADWD sure is Essos-centric. In fact, 99% of Martin's world seems to be made up of it, with the people living there viewing Westeros as some insignificant backwater. Reading AGoT, I thought that part of the world would just be a jumping-off point for Daenerys. But no, it now has become the virtual main setting of ASOIAF. Why did Martin make that decision? I want to find out what happens in Westeros. Or do I? I'm not sure what the reader is supposed to be focused on because Martin is just all over the place. Toward the end of the book, Dany hallucinates and talks to Jorah Mormont who reiterates that he told her to go to Westeros because Meereen was not where she belonged. I felt as if Martin was mocking us because it's what every frickin' reader would have told her as well. So why did you make us read hundreds of pages about her fretting away in Meereen?! And, at the end, she seemingly ends ups in the same place she was in AGoT! There are also numerous characters whom I think Martin wants us to be invested in, but we just aren't because they're either not too interesting or they get lost in this morass of a book. I'm sure some readers do, but do most of us care at all about characters like Asha, Victarion, and Euron? Even Theon/Reek got old by the second half of the book. And honestly, are we supposed to care about what happens to the the billions of people in Meereen like the Brazen Beasts, Stormcrows, Sons of the Harpy, Hizdahr, etc.? Everyone in Meereen, save a couple, are pretty much terrible people and I couldn't care less what their ultimate fate is. And let's talk about Quentyn Martell. He and his journey to court Dany get no little page time, but the only purpose he serves is to free the dragons. That's it. Now that's fine, but there was no reason for Martin to spend the chapters he did on him if he was a simple plot device. Lastly, everything in this series is miserable and depressing; and this is coming from someone who LIKES dark books and movies. But, my goodness, nothing uplifting at all happens. It's just one gloomy event after another and everyone is either angry, oppressed, or psychotic. Martin goes out of his way to ensure that absolutely nothing remotely pleasant happens. I understand there are books with such tones, but after nearly 5,000 pages of it, you get a bit worn down. I know a big appeal of the series are the ""gray"" characterizations, and I agree, but does nearly everyone have to be a murderous sociopath with no regard for human life? This worked in the first three books because we weren't sure what characters we were going to root for or against. But now, we know who has a shred of decency or not and the incessant melancholy is tiresome. This was the first book which I had to put down and read another book in between with before mustering up the motivation to finish. Usually, I'd just abandon a book I wasn't enjoying, but after reading 4,000 pages of the series I couldn't quit on it. Books 1-3 were fantastic. A Feast For Crows began the downslide but I figured it was merely setup. But ADWD was even worse than setup because NOTHING HAPPENS. I'm really torn over whether I'll read The Winds of Winter if and when it's released. I don't think I have it in me to read another novel like ADWD. I only started this series a few months ago, so I read all these books back-to-back (excluding the one I read three-quarters of the way through ADWD to keep my sanity), so I saw the decline of storytelling with this series happen in real time.","2017-07-10","United States","","true","64","https://www.amazon.com/gp/customer-reviews/R29SSLX8GUIP0F"
"B003YL4LYI","4","Wish he had finished the series","Incomplete author - disappointed-","2025-04-09","United States","","true","65","https://www.amazon.com/gp/customer-reviews/R2TFKPFFBUTDZK"
"B003YL4LYI","4","Yes, Words Are Indeed Wind: a Long Gale-Force Song","I've never ""reviewed"" a book that has harvested as many comments as this one has. What's left to be said? Well, an admiring comment and a kvetch, for the record. Simply to repeat what his admirers already abundantly know, GRR Martin is a great storyteller, indefatigable researcher and plotter - all the way down to the ground: his character files must be interesting - and builder of plausible worlds. What I think, though, is that for most readers, and certainly for me, it's the intricate political intrigues that captivate and that have pulled us through more than 4000 pages of narrative text. Martin gets power politics and certainly understands, probably at a doctoral-dissertation-research level, the late-medieval-world interactions of great houses competing for crowns that made such stimulating history and - add three dragons, a few giants, a large dollop of magic that's both creepy and creepily religious, and the palpable fear of the often mentioned, seldom-appearing undead White Walkers - that inspired him to build a world that perfectly contains these immensely entertaining, alternately shocking and howlingly funny, grand yet finely detailed, operatic, dynastic stories. But I ask his fans (and I don't follow the blogs or much of the online discussion of the books - I do like the Wiki, though, which serves as my character/place/backstory memory - but I presume this is a topic of intermittent discussion): doesn't Martin need either a significantly greater measure of self-control (as in 'mastering the ""Stephen King I-Have-a-Word Processor-Now Syndrome""') or a somewhat more ruthless editor (as in 'getting someone else to master the ""Stephen King I-Have-a-Word Processor-Now Syndrome""')? A Dance with Dragons, the longest novel in the series, is stuffed with filler - okay, fairly high-quality, intrinsically interesting filler - and is probably 15 to 20 percent longer than it ought to be. It's almost as though Martin has to overwrite and overstuff to in some way justify all those delays and blown deadlines. (I know: this is a churlish, and probably mistaken, point from an unreservedly grateful reader who should just shut his mouth.) But there are indeed long stretches of slogslogslog. A thousand-plus pages (okay: 959 pp of narrative in the hardcover edition) is a lot to ask of loyal readers, even given the fact that fantasy writers tend to have acute cases of generally justified logorrhea - I mean, it takes time to create plausible new worlds and thoroughly realized characters - but, jeez, a snip here, a clipclip there, and we could lose 100-150 pp. Can't we? (I appreciate, however, the 15 page or so cap on each chapter, which at least let's us get to the next episode in each of a half-dozen separate major narratives that are simultaneously unfolding.) Ah, despite and still...we of course eagerly await the next installment, and trust Martin has sufficient years remaining - hell, he's only 67, and 85 is the new 65 - to wrap up books 6 and 7 and even move on to an 8 in an adjacent piece of his Westeros and the Free Cities. You go, Jersey Boy...","2016-02-28","United States","","true","66","https://www.amazon.com/gp/customer-reviews/R3MX7YRCGHFKCM"
"B003YL4LYI","2","Plagued With Over-Description and Plot Inertia.","Disclaimer: I am not yet finished with this novel. I'm currently on page 579 and finding it very difficult to go on. There will be some spoilers pertaining to what I've read so far so read at your own risk. Now onto the review: After reading A Feast for Crows, I remember simply feeling disappointed and rather apathetic towards the book. Nothing of significance really happened and too many of the characters just felt like unneeded extras in a series that already has enough characters and houses to keep track of as it is. After the emotional rollercoaster that was A Storm of Swords, it was simply an uneventful disappointment. Looking back on it, I can't recall many significant scenes or plot events from it. With Dance, this trend unfortunately continues. Though the characters that we all loved who were absent in Feast have returned (Tyrion, Daenerys and Jon Snow), they all seem uncharacteristically static and just not interesting, and when Tyrion chapters aren't interesting you know something is wrong. It feels like they all got lobotomies since we saw them in ASoS. Jon sits around on the Wall, Tyrion gets hauled around like a sack of oats and falls off a pig and the once charismatic Daenerys suddenly becomes a passive damsel in distress who spends all her time second-guessing herself while pining for a mercenary all with the personality of a post. This is not compelling character development. And on the topic of Daenerys, am I the only one who completely gets pulled out of the story whenever one of her chapters pop up? Everything happening in Meereen just seems so far removed from the events at the Wall and Winterfell that I just don't understand why we're being told about it. I understand Dany's story arch and her significance as a character, but she's been doing nothing crucial to the overall plot for so long that her chapters are becoming a burden to the pacing of the series. At this point, we need to see her making some progress with her dragons and getting ready to head to Westeros already. Instead she's smashing a slave trade and falling in and out of love with a mercenary with the personality of a brick. She's completely regressed as a character. With a title like A Dance With Dragons, I thought for sure we'd see her character develop in some major ways, but nothing. What happened to make the three main characters so boring though? Maybe it was just me...So I flipped to a random chapter from ASoS and sure enough, the writing and pacing there were still as excellent and tight as I remember it. If Feast showed us one thing, it's spending an excessive amount of time on a novel does not guarantee a higher quality product. If anything, the opposite is true. Many felt Martin was taking his time to ensure a quality product, but just like Feast before it, it's the opposite. I think the reason behind the wait was Martin simply doesn't know where he wants to take the series anymore so he's stalling, and that's what a lot of ADwD feels like, stalling. Many reviews have already made mention of this, but it bears repeating. This novel reads more like a travelogue or restaurant menu than an actual novel with any meaningful progression. I've passed the halfway point and it's amazing how little character progression has been made. I honestly wouldn't be surprised if Martin was being paid by the word. There's so much padding and simply meaningless rambling that I've been half-tempted to just skim paragraphs, something I make a rule to absolutely never do when reading. Here's a particularly bad offender from a Jon chapter that literally made me sigh upon seeing it. Located on page 219 of the Hardcover, it reads: ""In the granaries were oats and wheats and barley, and barrels of coarse ground flour. In the root cellars strings of onions and garlic dangled from the rafters, and bags of carrots, parsnips, radishes and whire and yellow turnips filled the shelves. One storeroom held wheels of cheese so large it took two men to move them. In the next, casks of salt beef, salt pork, salt mutton, and salt cod were stacked ten feet high. Three hundred hams and three thousand long black sausages hung from ceiling veams below the smokehouse. In the spice locker they found peppercorns, cloves, and cinnamon, mustard seeds, coriander, sage and clary sage and parsley, blocks of salt. Elsewhere were casks of apples and pears, dried peas, dried figs, bags of walnut, bags of chestnuts, bags of almonds, planks of dry smoked salmon, clay jars packed with olives in oil and sealed with wax. One storeroom offered potted hare, haunch of deer in honey, pickled cabbage, pickled beets, pickled onions, pickled eggs and pickled herring."" ...WHO. CARES. If this was an isolated incident of a bloated description, I wouldn't be complaining, but long-winded passages like the one above, particularly the ones describing food, plague this novel. Maybe they were in the first three as well, but there was enough plot development in those that I wasn't particularly bothered by them. The plot inertia combined with these overly descriptive passages that amount to nothing are simply trying my patience. Others have pointed out the ""Turtles"" paragraph as well, another offender among many. Another recurrance that's beginning to grow weary is the constant repeatings of certain characters' quotes. How many times do we need to read ""You know nothing, Jon Snow"", or ""Where do whores go?"", or ""Reek, Reek, it rhymes with Meek/Weak/Leek/Sneak, etc"", or the constant reminder that Tyrion killed his father while he was on the crapper. It was a rather major plot development, we don't need to be reminded of it in every single Tyrion chapter. This novel simply has no business being over a thousand pages. ASoS was longer, but the length never even occured to me because it was perfectly justified. Not so here. To be over halfway through the novel with this little plot development simply isn't acceptable. Nobody should have to slog through five hundred pages (or possibly more) of general fluff for some hope of meaningful plot advancement. As the old saying goes, ""Fool me once, shame on me. Fool me twice, shame on you."" Despite the love I once had for this series, I won't be picking up The Winds of Winter until I read the reviews on it. If it recieves a similar reception to AFFC or this one, I'm done. I'll probably just look up a plot synopsis online. It was a good run, but it appears Martin's passion for this series has simply fizzled and died. I don't really blame him for that though, fifteen years is a long time to be working on a single series, but for him to discount all Amazon reviews as being ""sockpuppets"" insults the intelligence of his readers. I still hold the first three novels as some of the best in my collection, but unfortunately, I'm bowing out after this dance. It was a good ride while it lasted. I'll continue trying to find the motivation to finish this novel and possibly update my review to reflect my final verdict when I'm done, but with the first half of this collosal tome being as uneventful as it's been, I'm not holding my breath.","2011-07-26","United States","","true","67","https://www.amazon.com/gp/customer-reviews/R2570YR04IA6BV"
"B003YL4LYI","5","Finally... a return to the ""Ice and Fire"" series","""A Dance with Dragons"" is the 5th book in the ""A Song of Ice and Fire"" series by George R. R. Martin. The hardcover is 1040 pages in length while the Kindle e-edition is a 2119 Kb download. SPOILERS Within the first few chapters you'll be reacquainted with Jon Snow, Tyrion, Daenerys and Bran. Four important players that were absent or scarcely mentioned in ""A Feast of Crows"". The location of these four individuals is as follows... 1.) Jon Snow's story is at The Wall...probably my favorite tale. 2.) Tyrion's...travels through the Free Cities area...slow to get going but improved with time. 3.) Daenerys...at Meereen on the Slaver's Bay...a very slow tale to develop (to the point of thinking about skimming some of it). 4.) Bran...an interesting trek north of The Wall, with a less prominent role than the other three...one gets the feeling that there are important things in store for Bran in subsequent books. There were also several other individuals whose tales were very interesting, in particular Davos, (acting as the 'hand' for King Stannis Baratheon at the Isles of The Three Sisters and at White Harbour) and Theon (Lord Ramsey's prisoner). END SPOILERS In addition to this fine story, some other things I liked about the physical book itself... 1.) three maps: Beyond the Wall, The Free Cities and Valyria. These maps seem to have greater detail, giving information on names, places, distances and direction. [but see Cons: 1.a) below] 2.) an appendix in the back with an extensive Dramatis Personae...listing all the Houses (as well as lesser groupings), the characters within, their relationship to each other and sometimes, their present location. Concerns: Regarding the maps... 1a.) in the Kindle format the maps are almost illegible. And unfortunately they become more indistinct as you expand them. This of course in not a flaw of the book but rather the limitation imposed by the Kindle rendering process. 1b.) the three maps are hard to relate to each other. You have a vague sense of the geographic layout, but because there is no overall master map of the entire area, it is somewhat difficult to get a feel for the 'lay of the land' as to how the three maps provided are positioned geographically in relation to one another. 2.) Daenerys tale...slow to develop and repetitive to the point of being annoying. Conclusion: With the return of the major characters of the previous books, my interest in this wonderful series has been rekindled. A definite improvement over ""A Feast of Crows"", not only because the more important characters have reappeared, but the intrigue and tension so familiar with the first three books (with the exception of Daenerys story), has returned as well. Overall, despite the minor concerns mentioned above, I loved it...after a hiatus of many years it's been worth the wait. And not unexpectedly, Book 5 ends with many situations and developments hanging in the balance. 4 1/2 Stars. Ray Nicholson","2011-07-12","United States","","true","68","https://www.amazon.com/gp/customer-reviews/R1YWKFY0E0DPT3"
"B003YL4LYI","4","Not his best, still fantastic","I'm a big fan of George R. R. Martin. Since discovering the A Song of Ice and Fire series many years ago, I've anxiously awaited (and awaited...) each new book in the series. I read his blog daily. And so I'm probably a little biased. Much has been thoughtfully covered in the preceding reader reviews, so I'll just offer up my 2 cents worth of random thoughts and anecdotes. Firstly, four stars. This isn't a perfect book. As others have mentioned, the plot perhaps meanders a bit, and the consistency of some characters can be justifiably questioned. And yet, from the perspective of this longtime fan, the sum of the parts remains as brilliant as expected. I savored each page, soaking up each new detail and happening, and anxiously tried to ignore the voice in the back of my head reminding me that it was one page closer to the end. The return to GRRM's world felt great! Prior to the release of this book, I was riding the subway and noticed a lady reading A Clash of Kings. I couldn't resist the temptation to reach out and ask how she was enjoying it. To my surprise (this was the first person I've met that didn't read and fall in love GRRM's series), she said she found it overrated compared to ""other"" books, poorly written, and aimed at the gender that wasn't hers. She also claimed to be a big fantasy fan, and when I asked which books she enjoyed more, she named only The Lord of The Rings. Hard to argue there :) I was reminded of this encounter while reading A Dance with Dragons. I've never thought of the series as being especially geared towards one sex or the other, but ADWD did seem particularly violent. Years have passed since I've read the previous books and I can't recall if they were as descriptively cringe-inducing. This is more food for thought for me than anything else. I'm certainly not bothered by it, and I'd argue that it adds to the contextual realism and depth of character in most examples. At the same time, it may give me pause before recommending this book to my girlfriend or that lady on the subway should we meet again. Lastly and leastly, while wading through reader reviews, I was shocked to find as much vitriolic negativity as I did. I have no worry with the 3 star average - as pure standalone fiction, this probably isn't as strong as the first books - but if you've journeyed this far, how can you not relish being back in this fantastic world that GRRM presents us? And what good would any review be without a little zany conspiracy theory? Here it is: it almost feels as if there were some collective campaign to spam this reader reviews section with harsh complaints and poor reviews. I enjoyed every minute of it and can't wait for more.","2011-10-03","United States","","true","69","https://www.amazon.com/gp/customer-reviews/R367ABY28FA23H"
"B003YL4LYI","5","Great job","A Dance with Dragons (A Song of Ice and Fire, #5) By George R R Martin I can understand why this book took so long to write, and like the author I can say i have finally finished the book. I love knowing what happened to the characters, to find out that Jamie disappeared leaving his sister to face her accusers, and a trial by battle for her treason with out a her ""true"" champion. Seeing that Ayra lived and survived in her world is something i have been waiting for. I worry about John Snow, and how dynamic and graphic the last scene he was in.... now i hope i don't have to wait five years for the next book. finding out what happens at the wall, made the story more dynamic and dramatic. I love the knights watch and all they have to do to face the north the wildlings and the cold ones. Finding that Daenaries lived through the siege of Merrien, and how she was able to ride her dragon is so climatic that i can't wait to see how she is able to regain her armies. It was an interesting twist that the infant that was dead in all the other stories had survived, now i understand the subtle hints within the dynamics of the red keep. This is a great story, continuing and leaving the reader always wanting more, questioning about characters not spoken of in this book, and wanting to see what the next part of the story is..... Can't wait for the next story.... Great Job GRRM.","2024-01-24","United States","","true","70","https://www.amazon.com/gp/customer-reviews/R1DKY9MS57DB9S"
