"productAsin","ratingScore","reviewTitle","reviewDescription","date","country","variant","isVerified","position","reviewUrl"
"B003YL4LYI","5","Why I loved it and some hated it.","So let us get some stuff out of the way. The first three are amazing. The fourth was lacking a little bit. Now that is out of the way lets talk about A Dance with Dragons. There is so much being thrown at this book series. I believe we should examine a few of them. The first I would like to address is I don't care how long it takes in between books. I think people would be a lot more kind to this novel if it had come out a year later instead of six that it took. I would say that anybody that this bugs has a valid point, but for me it just doesn't matter. I wait patiently for these type of things. So while I think they have a point it didn't ruin any part of this book for me. Another thing is ""that nothing happens and that it is just a placeholder for this series"". Again I could see it. Books four and five are the middle in this long series. Martin can't rely on it being new nor can he rely on its ending to maintain the narrative edge. So having said that I expected that these two would be like this. In a trilogy it is always the middle that suffers. When going into a massive series like this you need to give a little to get a lot. A trilogy is nice and clean having a beginning, middle, and end. A series of this size can't be like that. When entering into a saga of this size there is always going to be a little place holding. Some have commented on that certain characters take a step back in their development. This is also true. What the endgame is with this form of storytelling is that when the series is done that the impact will be greater on the reader than if told in a clean three act structure. This means that books six and seven (could) should be better for the very fact of the place holding that four and five have done. This will lead to the argument ""that this is all well and good but I just didn't enjoy this part of the story"". To those people I would say that you are right in your opinion. It's just that I have a big picture view while reading these books. Meaning that I enjoyed the heck out of this book. The argument has been made ""that it has to many new characters"". I see them as frustrating as well but I keep in mind that characters grow more interesting the more you read of them. Perfect example would be of Davos. I was not that into him in book two. When I got to book three I loved him. This is Martin populating his Universe before he starts to break it apart. One good note that some might find interesting (as I did) is that Martin said that books six and seven will not contain any new POV characters excluding the Prologue and Epilogue. So if nothing else you won't have that problem going forward. One note of interest is that the critical reviews for this one have been very good while reviews on amazon have been less than kind. I thought when the critics reviews came out that everyone was going to be happy again. That didn't happen. It is for this reason I decided to write my review from this kind of perspective. I hope this review shows that I loved this book but understand where you guys are coming from. I think anybody that gave this book a one star review was right. That is what they believed. They can not be wrong it is their review. I myself enjoyed my time Westros. I love epic literature like this. I will be looking forward to the sixth book as I hope you are too.","2011-08-04","United States","","true","37","https://www.amazon.com/gp/customer-reviews/RADUZ8M12XWHI"
"B003YL4LYI","4","Winter is coming","It's autumn in Westeros, blizzards are already blasting the Seven Kingdoms with brutal force, and ""winter is coming."" Jon Snow is treading a dangerously fine line between keeping the vows of the Brothers of the Night's Watch and involvement with King Stannis' revolt. Tyrion is on the run for his life and hopes to find an ally with Queen Daenerys, but as is always the case with the Imp, he just manages to trade one peril for greater ones. It is Daenerys' destiny to reclaim the Iron Throne for the Targaryens, but doing so now means leaving her conquered city to her enemies and the slaves she has freed to their former masters. Meanwhile, her dragons are growing bigger and more unmanageable. As all the great houses make their bid for who will rule the Seven Kingdoms, north of the Wall the restless dead are gathering en masse to invade with the winter storms, adding slain victims to their ranks. Just as all the previous books in A SONG OF ICE AND FIRE have been, A Dance with Dragons is a tombstone-sized doorstopper of a book. (I purchased the Amazon Kindle version, and I swear my Kindle was heavier after I uploaded it.) An age has passed since A Game of Thrones kicked off what just might become the most influential series in fantasy since LORD OF THE RINGS. I've been anticipating A Dance with Dragons ever since I read the last sentence of the last book, A Feast for Crows, almost six years ago. A SONG OF ICE AND FIRE is a colossal-sized epic. There is no getting around the fact that this series is really one long book. I think Mr. Martin's idea of a conclusion for each book has been to build up to the most shockingly climactic outcome imaginable and then leave the readers in a nearly painful lurch of a cliffhanger. (Fair warning: the ending of A Dance with Dragons is no exception.) This is made almost intolerable by the fact that fans will be lucky to get more than one installment per decade. But if you can put all that aside and just take the events as they happen in A Dance with Dragons, there's no denying it's another grand adventure. George R.R. Martin is one of those authors who could write the Yellow Pages and make it exciting. As complex and as large-as-life as this story is, and even considering how long it's been since I last visited his world, I had no problem keeping up with A Dance with Dragons. Martin has created some of the most interesting characters ever, and there are so many of them. It's amazing how he can tell a story from so many unique perspectives. I'm not sure I even know as many people living in the real world as there are living and dying within these books. He draws the plot out like a sharp blade from a scabbard -- one that will easily cut the careless. His underlying theme that every hero is the other side's villain is profound and believable. All the players in this deadly game of thrones have a strategy that seems like a guaranteed victory. But since Martin solidly established early on, that no one -- I repeat, no one -- is safe, it's anyone's guess who will hold the Iron Throne when this is done. Providing there will even be a throne to win. That will depend on the Crows holding the Wall against the wights and other monsters that have yet to strike in full force. It almost seems impossible that Martin will actually be able to wrap this thing up with a worthy conclusion, and do it in both his and his readership's lifetime. Call me crazy, but I think he can. Afterwards, blurbs on fantasy book-covers will claim comparisons to George R.R. Martin and A SONG OF ICE AND FIRE, like they do now for J.R.R. Tolkien and LORD OF THE RINGS.","2011-08-17","United States","","true","38","https://www.amazon.com/gp/customer-reviews/R1SBEMG2F4NAC4"
"B003YL4LYI","4","A good book with several flaws","After waiting six years for this book, I found that I didn't dive in and devour it like previous releases. I think after waiting so long, I felt like it could stand to wait a few days more without killing me. The Kindle edition starts right at the Prologue, which I found really annoying because George RR Martin gives a little foreword about the chronology of this book. If I'd read that first I might not have been so confused about the first few chapters I read. You have to realize that the first half of this novel is the other half of A Feast for Crows, so you end up reading a lot of overlap. In fact, one Jon chapter reviews *exactly* the same scenes as a Samwell chapter in Feast, which really annoyed me because I'd just re-read the first few Feast chapters so it was like reading something twice. That being said, it was great to finally learn more about what happens to Tyrion after his escape from King's Landing and more about Bran in the north. I think I've figured out who Coldhands is! The book delivers several shockers, revealing new characters and bringing back several old ones. In direct contrast to his murderfest in Storm of Swords, he goes on in Dance to prove that you shouldn't believe someone is dead until their body is being packed up by the Silent Sisters or they stop having chapters. Martin has become really good at a very slow ascent of a character's chapter culminating in a serious cliffhanger, then moving right on to someone else, driving you completely mad. The cliffhanger ending works well for linear perspectives, but when you're switching off to someone else in the next page, all it does is drive your readers crazy. With this book, Martin seems to be using chapter titles as a method of character evolution, using different descriptions and names for the same characters. I personally found it kind of annoying, but in the case of a certain ironborn, it did a lot to mark his progression through the story. There were several character perspectives that I just didn't care about and I don't really know what the point of it was. For instance, the Prologue. I thought it would serve some grander purpose later in the book, but I think it could have been accomplished with a simple paragraph in a Bran chapter. I found myself falling asleep during the Victarion and Quentyn chapters. Seriously, even if it's set-up for later, it just felt like fluff. Being that this book is called A Dance with Dragons, I expected practically every Dany chapter to be like her second to the last one and I expected her last one to end in a fiery blaze of Targaryen glory. Instead I was given a rather ho-hum ending to a season of The Bachelorette: Meereen Edition. The book is very Jon-centric, with something like every 2 chapters being about Jon. While I didn't mind this, I think it could have been condensed a little. Barristan chapters were particularly enlightening because he is so old and knew so many people from the past that we have only heard about in stories. Reek chapters were fascinating and Martin shows his unique ability to make you feel for a character you previously completely despised (as with Jaime). Sansa is completely absent from the book. While there are some truly magnificent chapters in the book and I'm happy with the advancing he did of the story, it's not the best book of the series by far. I'd rank it second to the last, beating out only Feast for Crows. Still, I give it 4 stars because I did like it. It just wasn't perfect.","2011-07-23","United States","","true","39","https://www.amazon.com/gp/customer-reviews/R1AOIUAA9NQLO"
"B003YL4LYI","5","The story continues, and the world enlarges...","I am a bit surprised at the number of very low reviews for this 5th installment of the series. (?!) I cannot agree with those that say this book was a huge disappointment. Perhaps if I had waited 5 years or more, for the ""exciting conclusion"" I could see it, this is NO conclusion - but I read all 5 volumes over the summer on my Kindle - and honestly, the line between the end of one volume and the beginning of the next becomes a bit blurred that way. I was enthralled with the entire story...INCLUDING the so-called ""diversions"" of the Ironmen, the slow pace of change in Dani's world, and even the journey taken in vain by Brienne. In fact, that ""side plot"" I found fascinating, and felt that I was along for every painful step with her small group for the journey. So many negative reviewers have complained about the non-character chapter names. But, in fact, the new names for chapters about old characters are themselves very insightful. And how can folks complain about Martin's long and detailed descriptions of the heraldry, family histories and long-ago events?? This is part of what makes his world so complete and detailed! It's like reading LOTR AND The Simarillion together. I don't understand the cutting criticisms of Martin's recurring character motifs like ""You know nothing, Jon Snow"" or """"If I look back, I'm lost"". Yes, they appear a lot - no, it's not ""repetitive"" - any more than are the things that we ALL have coming back to haunt us in our memories from time to time. When something that we see or hear, has a huge impact on us, it causes us to re-think it over and over, perhaps for the rest of our lives. I have many such memories and voices from the past that I live with. Nor am I tired of the descriptions of the ravens landing on Jon Snow each chapter. I LOVE them. The ravens are a constant link to the past, they landed on him right from the start. I LIKE the repetitive quotes of ""Hodor!"", and I LIKE the slow-paced minutae of the hour by hour struggle through snow, forest or swamp...I have not personally found one boring moment in this narrative...or, if there is some times where the action is slower and the land is quietly patient, it only adds to the realism of a world ravaged by war, and trying to slowly recover! In short, this last installment was every bit as enjoyable to me as ANY of the first 4. Unless a reader is really just looking for more battle scenes or hand to hand combat with the undead, or just ""more of the same"" as the first books, this volume is EVERY BIT as rewarding as any of the others. In fact, I actually count it, and the many subtle suprises (Like, who was sent to find Jon's sister!) - and it's relentless march towards the upcoming climaxes - to be my favorite of the 5! So, it feels odd to see so many 1 and 2/5 reviews - I'm frankly astounded. I might be because, although I am an avid reader, I have NOT read many of these ""multi-volume"" fantasy series, and am not so aware of what these readers expect. Dune, Cities in Flight and LOTR are about the only others I can recall. And I tend to view those series as a ""whole"", not several parts of a whole. I give this volume, a Dance with Dragons"", 5/5: I thought it was fantastic - I had never even HEARD of GRRM until last summer, and I couldn't put it down from the start of volume 1 to the end of volume 5, and it never would have occured to me to ""skim"" the outlying bits, or subplots, as many have suggested (??)...not one word!","2011-10-05","United States","","true","40","https://www.amazon.com/gp/customer-reviews/R643CJ2QIOQGG"
"B003YL4LYI","4","If I look back, I am lost","Today, just to prove a point, I read the opening of Game of Thrones. There is no denying - through the series, GRRM's writing has become careless and unwieldy. Hi He resorts to having characters repeat the same stale catch phrase again and again and again. Dany: ""I am only a young girl who knows little in the ways of war"" Tyrion: ""Where do whores go"" Barristan Selmy: ""I am too old for this"" Theon: ""Reek Reek rhymes with leek/meek/weak....."" And so on.. Like the storyline, the prose stalled and lumbered. Yet, that wasn't the biggest sin. What of our favourite characters? (SPOILERS). Tyrion - the cunning influencer, the unsung hero of Blackwater, has just a couple of talents remaining - making ""big people"" laugh and being an obedient good little dwarf. He takes to the role of the slave as if he's prepared all his life for it. Serving at feasts, riding a pig, wiping his big master's bottom - wouldn't any regular lordling learn all that growing up a possible heir to the richest family in Westeros? Dany - OK, she wanted to rule. But she doesn't. Some days she can't be bothered to hold court. She wants to float in her tub under the persimmon tree, and lounge around her terrace watching the ""pyramids of Meereen"". And choose outfits to greet Daario in - she's only a young girl who knows nothing in the way of war! She doesn't execute a single person, despite her own people falling like flies, and that's the same girl who nailed a hundred slave masters to crosses as a payback for slave children murdered in the same way, who sacked Astapor after cheating its masters out of the Unsullied, the girl had crossed deserts and conquered cities on her way to win back the Westeros throne. About that...It's all about peace now, man. Bran - becoming a tree? Really? The boy has crossed into the North Lands to get his legs back, and the best he can get is the offer of even less mobility. Arya - morphing into a chick from Kill Bill. Not that it is a bad storyline on its own, but having spent two books trying to find her family - anyone - this leaves me a bit bewildered that she makes no attempt to get news about any of them. She knows that Jon and Sansa are alive, and seems to have made a choice to forget about them. She enters this book as the Faceless Men wanna be, and exits as the Faceless Men wanna-be. How far she's come! Jon - knifed. OK, most theories seem to agree that he won't die, but you have to wonder why GRRM created such a noble, proud house populated by people you want to know more and more about, only to wipe out most of them so early in the series, maim and rain misery on the rest for the remainder of it. Jamie - appears only to tell us he is galloping off to join Brienne...not without telling us - again - that Cersei has done Lancel and Osney and possibly Moonboy.. As a tradeoff, GRRM unleashes a plethora of inconsequential, background characters, some of whom are quite disgusting, to make matters worse. Victarion comes to mind, brutish, cruel, stupid man. His casual cruelty and abuse towards his ""dusky woman"" was quite painful to read about. Why oh why do we need to know about him? Look, it is still a good read. It is still an amazing universe of characters, cities and events, still epic in its depth. I will still be buying the next book, if it ever comes out. But GRRM needs to cull and spare us the scum of Westeros. I've come too far now to stop reading - if I look back, I am lost!","2013-10-17","United States","","true","41","https://www.amazon.com/gp/customer-reviews/R354R3PS1YP0L3"
"B003YL4LYI","4","Epic series","This book seems to have pissed off a lot of Martin's fans, but I loved it. I love these characters, the new ones, the old ones, the ones that suddenly reappear from the earlier novels (it rhymes with geek!) This wasn't as exciting as the first three, until the last 200-300 pages, but the world he lays out is so much bigger now. What he was trying to do with this was incredibly ambitious. 90% of the time, he succeeds. My prediction - after he finishes the next two or so (and based on the last third of ADWG, those are going to be some of the best in the series) the 4th and 5th books will have a lot higher respect because of how they enriched the series. ------ EDIT: Here's more on why I mostly liked this book (VAST SPOILERS) Dany - one of my favorite characters in the series - her chapters were the hardest for me to like. She makes terrible decisions in this book that we're forced to slog through. Chaining up the dragons pays off in the end (for the reader), but the marriage decision...ugh! I can understand what Martin was doing. She's a teenager making poor choices, as she has in the past, and it took a number of chapters to make those events believable. I guess it makes sense - from her perspective, she has no idea what's happening in the world around her, and she's about to get obliterated by a number of armies heading to Meereen, but I wanted the sly, surprising, vindictive Dany of the first three novels instead of this. However...I thought where he left her at the end was brilliant, and the dragons unleashed were superb. Tyrion - I enjoyed his chapters, although I can see why some would not. He's not a good person in his book, as much as he was in the previous ones. But I give him some slack here because he's outcast, left with nothing, hunted and hated. He's perceived as an ugly scarred monster, and his behavior feels real. He's self destructive and depressed. His story did seem to drag in parts, though. Jon - Sadly boring as commander of the watch, but the chapters are succinct. Knowing the ending, I'm looking forward to rereading his chapters. I DO NOT think he's dead, but that would be an interesting twist. Bran and Rickon - I love this story arch. I wish Martin had spent a lot more time with this instead of some of the other characters. The walkers coming out from under the snow was one of my favorite parts in the book, and finding the children of the forest. Quentyn - my favorite new character. His demise was pitch perfect. Arya - I enjoyed her becoming a secret ninja assassin. Theon - This is why I love Martin so much. Somehow, unexpectedly, Theon has become one of my favorite characters, and his sister too. All in all, with flaws and some dry stretches, this book still has enough great things going on to warrant 4 stars. Books 2 and 3 were 5+++ stars for me. In fact, they are the best books I've read in years. This one could have been as good. It was disappointing in parts, exhilarating in others. I'm giving him the benefit of the doubt that he's going to knock our socks off with the next books. The story has been gestating in his head for 20 years, and around the last third of ADWD, it really started to pick up again. You could tell he's excited by where this is going. The dragons are terrifying now that they're grown, the characters are evolving, and he's been saving spider-riding white walkers for about 5000 pages now. My hopes are high.","2012-04-05","United States","","true","42","https://www.amazon.com/gp/customer-reviews/R3ARXJGX8CPIV7"
"B003YL4LYI","5","Winter has come!","-----NO SPOILERS IN THIS REVIEW------------ Having just finished this book, I am a little bit surprised to see all the negative reviews. Although after reading them all, I can see their points of views. However, I still believe GRRM has not lost his way and this story is just as compelling as the first 3. Many people think this story moves along slowly, and there is a whole lot of nothing and dialogue going on for much of the story. I can't say that isn't true, but I don't think it's a bad thing. The thing you have to remember is although this whole story is set in a fantasy setting, GRRM still tries to keep his characters, actions and reactions as human and realistic as possible. Where most authors will see it through the end that important characters will persevere, GRRM has no qualms with killing them off to progress the story. So with all the crazy whirlwind of events that have passed in the first 3 books, there is going to be periods of downtime, much like in real life. A Storm of Swords ended with the Tyrion murdering Tywin and leaving King's Landing in chaos, Stannis and his army coming to save the Night Watch at the wall, Jon becoming the new Lord Commander and giving quarter to Stannis, Daenerys deciding to settle down in Mereen after laying waste to the other slave towns, and all the Stark children splitting off into the unknown (and much much more). After all that, what's to be expected? Obviously the pace and action won't be able to continue. At King's Landing, we'll have to see how all the characters pick up the aftermath of Tyrion's actions. At the Wall, we will have to see how Jon settles into his new position and see how Stannis will plan his next actions now that he has a small foothold in the north. Across the Narrow Sea, we'll have to see how Daenerys will handle actually trying to rule a city. These events following the fallout of A Storm of Swords is obviously going to not be as action packed. However I truly believe that this story is just as much about character development as the lore. So while A Feast for Crows and A Dance with Dragons may lack the amount of action that some readers are looking for, it's still very very rich in character development, which I have enjoyed greatly. Also I think all the random characters that gets introduced for a few chapters are refreshing. One of the appeals of these books are all the different point of views that GRRM introduces. At least in my opinion, it feels like outside of Joffrey and Cersei, he does intentionally try to portray any side of the war as being the good guys or bad guys. They just are what they are, people fighting for their side of the war. Reading the story from one person's point of view will lead to bias on which side is ""good"" or ""bad"", so I welcome GRRM introducing some new perspectives to the story here and there. I really believe it only helps enriches the story. With all that said, I do believe A Dance with Dragons is deserving of a 5/5 rating. Although it lacks the action and pace of the first 3 books, it still does a spectacular job developing all the characters. But most importantly, by the end of the book, it has moved and set up all the pieces in this game for the Iron Throne for what should be a truly epic final 2 books. Winter isn't coming anymore....it has arrived!","2011-07-17","United States","","true","43","https://www.amazon.com/gp/customer-reviews/R279EFHJ23ETCE"
