"productAsin","ratingScore","reviewTitle","reviewDescription","date","country","variant","isVerified","position","reviewUrl"
"B003YL4LYI","2","A few juicy moments drowned in gruel","Warning, there are spoilers below. I really wanted to enjoy dance, bad. As upset as i was with the 5 year wait to get the second half of a mediocre book...i was really willing to give it a chance. I bought it the second it came out, brought my kindle with me everywhere so i could read it in my down time - paid close attention and picked up on little subtle things others might have missed - all this, and i was still disappointed. (not in the Kindle tho, this thing is awesome, and no I'm not getting paid to say this. It's perfect for someone who travels a lot for work). It really boils down to this - it doesn't feel like Martin enjoys writing about this world anymore. His behavior reinforces this feeling, too. It's like he's just bored of this world and has lost that energetic spark to create. Reading the first three books, it was like a man excited about the world he was building, excited about the stories, the characters, excited about what he was going to DO with them and he wanted to get there as smoothly and quickly as possible. Remember when Catelyn left for King's Landing in one chapter, and then arrived there next chapter? It's because the journey was unimportant - that stuff was filler - what happened to her IN King's Landing was important. Reading the last two, it was like he wasn't really sure what to do anymore, he couldn't figure out where he was going, he just had to fill up the pages with something, and he kept thinking back and forth on what to write. adding, deleting, adding, deleting - this is a worrisome sign when indecision, apathy, and indifference about a tale begin to rear their ugly head. It's this energetic drive when you have a story you want to tell. But I didn't get that here from Martin, which is disappointing, because the man has genuine talent. He just doesn't seem to be inspired enough to use it. I never got the impression of a clear vision. I didn't get a sense of his excitement for these characters. It shows up in a lot of ways - the tired cliches, the empty characterizations of the main viewpoints - it feels like Dance was a homework assignment to him, a very unwelcome homework assignment. ""This one was a three bitches and a bastard"", indeed it was, and that feeling comes across in his writing style. I really just feel he's bored and out of ideas. He's tired of Westeros, he isn't sure what to do anymore, and he's just stringing things along with random WTF moments thrown in to try and maintain our interest and fake excitement. It's similar to sudden loud sounds or 'GOTCHA' moments in bad scary movies; using cheap tricks to try and evoke a sense of fear when the plot itself can't. There are only a few moments where I get a sense of the old Martin. Reading Theon's chapters were interesting. Theon actually had an arc, an evolution, and you got the sense that George enjoyed telling this story. Too bad he had to ruin it with yet another cliffhanger ending. In fact, this was one of the few true cliffhangers in the book, in my opinion. The other 'cliffhangers' were never set up properly and are more like 'dangling threads' that came out of nowhere. We have Jon getting the Caesar treatment, Stannis marching on Winterfell, Theon and Jeyne escaping, Aegon landing in Westeros, the situation on the Wall, the Pink Letter... Too much buildup here with too little payoff! And then one of the big cliffhanger moments from the first book - Brienne - gets barely a mention in this! We are left to deduce what she most likely said and her agreement to lead Jaime to UnCat in return for her life - yet another plotline that goes nowhere. At the end of the book, effectively, nothing big or major has happened that we can see the result of. Dany is basically back where she started, realizing she should have gone to Westeros. The entire sideshow in Meereen has effectively accomplished nothing. A lot of interesting things happen to the characters that are ultimately irrelevant. The Others are still persona non grata, mentioned only in shadows. Dragons still haven't returned. Stannis hasn't really conquered anything meaningful. Tommen is still king. Dorne is still 'progressing'. The Ironborn are still the same. Not enough major action has happened. I can accept one book of mostly filler, but two? A Dance with Dragons feels like it was written to meet a word count! What's next, he goes through and increases the font size on all the periods to add some more volume? He might as well, it'd be just as entertaining. The problem is, Martin could have easily given us at least one big climax in this book. You could have given us a Meereen showdown with results, you could have given us Jon's ""death"" and obvious rebirth as Azhor Az'hai or whatever, you could have given us the Others finally attacking in force, you could have given us Victarion or Tyrion meeting Dany, you could have given us the battle of Winterfell and the results - there are so many things he could have done that we don't get to see. He could have given us the first use of Dragons in war, and that would have fit right in the with the title. I don't mind cliffhangers, but really we should have gotten SOMETHING resolved in this book so it doesn't feel like a giant tease. The few redeeming moments for me - Selmy, Wyman's awesomeness (""So young"" said Wyman Manderly. ""Though mayhaps this was a blessing. Had he lived, he would have grown up to be a Frey.""), ""Would you like Freys with that"", Theon - simply don't add enough to justify book for me. If you enjoy reading detailed prose, and seeing a world being built by a very skilled author, you might enjoy this. If you're a huge fan of everything remotely to do with the world Martin has skillfully created, then you will find a lot here to fill in the blanks. Unfortunately, most of those blanks were blank for a reason - we just didn't care. I still don't. If you're a fan of an engaging, interesting plot - the sort of plot that we saw in the first three books - I'd give it a pass. PS: Martin may denounce us here at Amazon as trolls and sockpuppets, but I think that makes a mockery of the good rating system that has made Amazon so useful for people like me in the past. Mr. Martin, if you read this, please make note of the 'verified purchaser' next to this review. I'm a real person, with a real opinion.","2011-07-21","United States","","true","16","https://www.amazon.com/gp/customer-reviews/R1J68H55X6FAKT"
"B003YL4LYI","4","Martin's writing has changed... but I still like it","The first three books in this series were fast-paced, with lots of huge, game-changing events per book, and that was part of the draw for me. A Feast for Crows and, now, A Dance With Dragons, aren't like that; they're slower, more contemplative, more thematically-driven rather than plot-driven. It's certainly a change, and I was initially a bit disappointed. But ultimately, I really liked A Dance With Dragons (and I ranked AFFC at 3.5). There isn't as much plot momentum here as in previous books, and at times I found that frustrating (although it helped to know about it going in). But I never found the book less than compelling; the character development is solid, the worldbuilding excellent, the writing good and the thematics strong, and enough happened to keep me interested. I enjoyed visiting new places on Martin's map and the immersive descriptions; it's as if I actually visited many of these places, something I value highly in any book. And I really enjoyed the look at the realities of leadership, seeing the characters grow and change, and gradually learning more about some of the backstory mysteries. It makes the most sense to discuss this book in terms of specific storylines, so I'll break it down (no spoilers!): DAENERYS: Unlike many readers, I found her chapters to be among the most interesting in the book. Previously she's done a lot of traveling, and it was cool to see her actually ruling here. The conflict between her values and principles and the realities of her situation was fascinating. A lot of people have been frustrated with her relationship with Daario, but despite his manifest unattractiveness I liked that too; Dany's at the age where this often happens, and how many fantasy heroines are allowed to have a fling? Also, this storyline let Martin flesh out Meereen more than he'd previously done with anyplace outside Westeros; in previous books I found Dany's ""eastern"" surroundings somewhat two-dimensional, but while the local characters still aren't as vivid as the Westerosi, here he goes a long way toward closing that gap. JON: Paralleling Dany's storyline, we see him trying to rule and the myriad difficulties he faces. Both he and Dany are faced with hard decisions and break new ground trying to do what they see as right, which didn't fail to keep my interest. Ends on a ridiculous cliffhanger--but while I've never liked Martin's ending books this way, he's done it since the beginning and I've gotten used to it. TYRION: His arc resembles Arya's in A Clash of Kings; he spends the book journeying toward a specific destination (Daenerys, in his case), and along the way he meets interesting people, develops as a character and faces a lot of personal reversals and changes of fortune.... without reaching his destination. I was a bit frustrated by this in both books (it's hard not to be). But there's a lot there, and it's interesting to see Tyrion try to make it without being able to call on the Lannister name or the wealth of Casterly Rock every time things go sour. THEON/REEK: Martin likes to challenge your opinion of a character. I didn't like this arc as much as many others; Ramsay is so two-dimensionally sociopathic and evil that it was hard to summon up any feelings toward him, and having hated Theon in previous books, I wonder if being victimized has really improved him. The jury's still out on that. ARYA, BRAN, DAVOS, JAIME, CERSEI: Only get a couple chapters each, although they're interesting. This book is certainly sprawling; there are so many characters in so many different places that it just isn't as unified as, say, A Game of Thrones. QUENTYN: Has an interesting storyline and a complete arc. He himself is rather dull, but he was intended to be. A thoughtful examination of the forces at work on somebody in his position. SELMY: Meh, kind of a less interesting copy of Eddard Stark. He's more another pair of eyes on Meereen than an important character in his own right. ASHA: Not many chapters, but hard-hitting and atmospheric. We get a taste of Westeros winter here, and it's a scary thing. Also, Asha herself is awesome. VICTARION: Also doesn't reach his destination, but there are some fascinating things going on in his chapters. I still hope somebody stabs him though. ALL THE OTHER PEOPLE: Yes, there are more. It's a big book. The downside is that when a chapter ends, we often have to go 100 pages or more before seeing that character again; the upside, that there's a lot going on. Ultimately, a lot of this book is setup, and I'm not thrilled with that; when most of the best books of all time are significantly shorter than this, does Martin really need nearly 1000 pages for setups and transition? It's easy for fantasy series to become self-indulgent, and here a couple arcs seem to have their climaxes deferred; others simply don't go where I thought they would, and that's fine. It's not a perfect book, aside from that--there are some important secondary characters who aren't very vividly drawn (especially true in Dany's chapters), but then there are great bit-part characters of the sort I've come to expect from Martin. I have some reservations about his treatment of gender issues--for the most part he does all right, and at least he's thinking about it, but at times he falls flat because he's just so entrenched in the male gaze. Despite all that, I enjoyed the two weeks or so I spent with this book. It's a well-written, intelligent novel, and enough twists and turns are thrown at the reader to keep me satisfied. None of the characters are the same as they were at the beginning of this book, nor are their storylines. A solid four stars.","2011-07-30","United States","","true","17","https://www.amazon.com/gp/customer-reviews/R317D6ZCAWMUJ8"
"B003YL4LYI","4","Books should not be judged by how long the wait for them is...","A lot of the reviews that have been negative so far for Dance talk about how ""the wait wasn't worth it"". But the thing is, for the most part these reviews only harp on the fact that ""oh, I've waited six years for Martin to finally finish it, but there's no epic battles/resolution/revelations"" etcetera and ""I waited so long for THIS? Oh man I'm done with the series"" blah blah blah. They don't actually talk about the story itself. And while I'm as critical of Martin for how absurdly long he makes his loyal readers wait between installments--especially since the argument could be made that a part of that wait is spent by him not spending as much time on writing as fans think he should--this isn't the place for those arguments. A book should be judged by its contents, not how long a reader waited for it. These people, while not completely unjustified in a lot of the criticisms they're raising--especially in the abundance of cliff hangers and open-ended storylines-- are missing the point of what, in my mind, makes A Song of Ice and Fire great--the characters, the unpredictable nature of where the plot's going to go, the wonderful world of Westeros and its environs, but again, most of all, the characters! Dance is much more about character development than other books in Martin's series, especially compared to Storm of Swords, in which almost every chapter involved some great action scene, or development, or advancement of the plot in some way. The pace here is more like that of Clash of Kings--and much better, not just barely better than Feast, which I think most will agree is the most slow-paced novel in the series. While it lacked epic scenes equivalent to the Battle of Blackwater, the wildlings' attack on the wall, or the Red Wedding, there's still plenty of solid content that should satiate most fans of the series, particularly the introduction of a storyline/group of characters that pretty much changes everything, and one cliffhanger for a certain character that I had to reread again, it was so exciting and unexpected. Again, its the characterization and not the war or overarching storyline that's the star of the show here. The POVs are essentially divided into three groups: those in the North and around the Wall reacting to the events of Mance Rayder's failed attack on the wall and Roose Bolton's rise to Warden of the North; Dany as she attempts to establish her role as Meereen's monarch and the various suitors and others attempting to reach her and her dragons; and a smattering of returning POVs from Feast for Crows which, while not completely resolving loose ends from the previous novel, do just enough to tie up those loose ends but leave the reader intrigued as to what happens next. The three main POVs are easily the most slowly paced, but they also have, in my mind, some of the best character development in the series. Jon is struggling to remain neutral in Stannis' efforts to win the north, while at the same time asserting himself as a strong commander. Tyrion has decided to embrace the image of the evil imp everyone else had wrongly made him out to be while trying to decide what to do with his life. And Dany makes decisions in her ruling of Meereen that may or not go against the destiny meant for her. I enjoyed the other POVs more than I did the main ones, but really, all of them, set the stage for what will hopefully be a brilliant next installment...whenever that may be. The new POVs (there are four--two are brand new characters and two are former periphery characters)are more or less welcome additions to the story, especially one of the new ones. Finally, Dance easily has the best one-shot POV (meaning prologue or epilogue) of the series so far. And the book isn't just nothing happening until the end as some are making it out to be--there is a HUGE revelation early on(not to mention another towards the end careless readers will miss), and one of the main POVs comes out of the gate really strong in a moment that had me cheering when I read it. No, it isn't perfect. But Martin can't make every installment of the series Storm of Swords or of its same exact caliber. Complaints for me include, that while cliffhangers aren't necessarily a bad thing, and some of them are excellent in this, others just left me going ""really? That's all we get?"" Martin definitely overuses his techniques of repeating phrases and describing food and fauna in a ton of detail. And while I enjoyed most of the POVs, I had a problem with two of the new ones--one only got one chapter, and the other, who was foreshadowed in the previous novel, just never became fully realized for me. But hey, at the end of the day, I got to be reunited with Jon, Dany, Tyrion, Bran, Davos, and other characters we haven't seen in years. And while there may not be a slambang, epic beheading, battle, or wedding people may have wanted as a reward for their long wait, there is still plenty of developments, and plenty of foreshadowing at things to come, that should leave most fans at least somewhat happy, or at the very least talking about and debating the events of Dance.","2011-07-15","United States","","true","18","https://www.amazon.com/gp/customer-reviews/R26NTL0LRK9PUC"
"B003YL4LYI","4","Totally Worth It!","Dance! I just finished it last night. If you just started? Don't stop! I wanted sooooo badly to skip ahead and get some hint of what was to come I had to force myself to slow down and take it one impatient step at a time. Isn't that just like Life Itself? I think the most valid comment/criticism I've heard so far that I can identify with is the fact that anyone following this Saga and patiently and loyally keeping up with it, is an extraordinary, intelligent reader who has stayed with the entire storyline and character additions, plots and sub-plots so much that we know it just as well, if not better than the writer! We don't need to be reminded of things, these books were not meant to be read singly, so please? Let's get ON with it! I'm as hungry as a Dragon and I need to be fed! I also know that I'm an extraordinarily impatient person and one of my life's lessons is to enjoy and savor what is in front of me today and allow the future to unfold as it will. Having said all that? I have also found over the last few years that re-reading has produced for me more ideas, plots and intrigue that I would have otherwise completely missed had I not been forced to go over it again and again for lack of new fodder. I really and truly appreciate that more than I can say, and interestingly enough? At the end of Dance, I already KNOW I rushed through it so fast I need to go back and marinade on everything again, lol. I meant to finish re-reading Feast before I allowed myself to start on Dance but I just didn't have the discipline, sorry. It was a real struggle, alright? The new book had just come in and I was ITCHING to get at it. I convinced myself that I remembered enough from Feast to get started, and then totally succumbed to the lust for MORE of Life in Westeros and beyond. (It was worth it, hee hee) I suspect that Feast and Dance will be the lull before the final Storm. I'm hoping that it will end up as ""Seven"" books altogether, that would be fitting don't you think? He needs to regain some momentum with the final books and put us all out of our collective misery of wanting more (and needing some resolution) with no doubt some sort of profound cliffhanger leaving us certain that Westeros will forever be a part of our lives. He's done such a good job of making this so much like life itself, forever uncertain, and timeless in every way possible. But even Martin has said that; ""Death comes to us all,"" so somehow he needs to bring a death to this, while also adding that magical layer of immortality we know to be the human experience when we look at our collective history and also into our children's eyes at the same time. I can't help but think he had to rush things (sorta) to get Dance out right after HBO Thrones, the timing is too perfect to think otherwise; but I'm so happy with the HBO series I can't really bitch too much. Maybe he will feel content enough to allow the HBO series to continue while he settles down to finish writing the rest of the thing, but I suspect it will all be about timing after this. He ""needs must"" finish the next book in time to be presentable after the 5th season of HBO is complete. And they can always make Feast into at least two seasons, or stretch any part of the Saga they want actually. So, here's my best guess. They'll make two more seasons on HBO with the next two books, start on the 4th Season with Feast (while he finishes up the 6th book) perhaps turn Feast into two seasons while they prepare HBO for Dance, and we won't see anything new for at LEAST 5 more years? We will all fall in love with the HBO version and hover around our televisions or laptops, watching and re-watching like the addicts we are. If George is kind to us? He will give us scraps of the future from time to time, and maybe even turn that into a new ploy of possibilities, just like a Priest of R'hllor tempting us by reading the future in the flames? Whetting our appetite with different versions of what may come? That would actually be pretty cool. Maybe I'll write him and suggest that, lol. In the meantime? I'm going back to Feast to catch myself up some more, and then earnestly going to try to sort out the whole Yunkai, Astapor, Meereen political mess. If I read another Hzzz something name without understanding who the hell it is? I'm going to shoot myself. Without telling you anymore? At this point my best advice is to go to the end of the book and sort out who is WHO among all the players in the Free Cities before you do anything else! Altogether? Great series, I'm hooked and this book hasn't stopped me from wanting more, not at all.","2011-07-21","United States","","true","19","https://www.amazon.com/gp/customer-reviews/R10GXRB0SQUBXG"
